{
  "$schema": "https://json-schema.org/draft/2020-12/schema",
  "$id": "https://deeplus.dev/schemas/language/trait-qualified-associated-static-selection-trace-closure-r1.schema.json",
  "title": "Deeplus R62 Trait-Qualified Associated Static Selection Trace Closure",
  "type": "object",
  "additionalProperties": false,
  "required": [
    "$schema",
    "schema",
    "revision",
    "canonical_baseline_commit",
    "local_predecessor_commit",
    "candidate_status",
    "language_status",
    "source_activation",
    "current_binding",
    "feature_ids",
    "authority_fence",
    "scope_fence",
    "descriptor_repair",
    "associated_item_kind_lowering",
    "existing_operation_alignment",
    "zero_runtime_contract",
    "diagnostic_fence",
    "out_of_scope_follow_up",
    "rules",
    "acceptance_cases",
    "acceptance_bindings",
    "machine_acceptance"
  ],
  "properties": {
    "$schema": {"const": "../../schemas/language/trait-qualified-associated-static-selection-trace-closure-r1.schema.json"},
    "schema": {"const": "deeplus.trait-qualified-associated-static-selection-trace-closure/r1"},
    "revision": {"const": "r62-local-trait-qualified-associated-static-selection-dynamic-trace-closure-r1"},
    "canonical_baseline_commit": {"const": "39a5d50cc770341c4b9776d00d84520b780d0c62"},
    "local_predecessor_commit": {"const": "0346f2cdd417618ffa0af144a1c37569da63a4c4"},
    "candidate_status": {"const": "APPROVED_NOT_INTEGRATED_LOCAL_CANDIDATE"},
    "language_status": {"const": "STABLE_DESIGN"},
    "source_activation": {"const": "none"},
    "current_binding": {"const": false},
    "feature_ids": {"const": ["trait_qualified_associated_static_selection"]},
    "authority_fence": {
      "const": {
        "new_source_surface_count": 0,
        "new_grammar_production_count": 0,
        "new_ast_identity_count": 0,
        "new_hir_identity_count": 0,
        "new_mir_operation_kind_count": 0,
        "new_runtime_mechanism_count": 0,
        "semantic_p0": 0,
        "feature_p1": "22_OPEN_UNCHANGED",
        "m13_actions": "4_OPEN_UNCHANGED",
        "product_lanes": "15_OF_15_NOT_RUN",
        "github_publication": "SUSPENDED",
        "evidence_level": "E2_STRUCTURED_STATIC"
      }
    },
    "scope_fence": {
      "const": {
        "transitioned_cells": [
          {
            "feature_id": "trait_qualified_associated_static_selection",
            "stage": "DYNAMIC_LOWERING",
            "outcome": null,
            "predecessor_disposition": "APPLICABLE_BLOCKED_BY_GAP",
            "predecessor_gap_id": "IR-XCUT-P1-054",
            "disposition": "BOUND_DIRECT"
          }
        ],
        "transitioned_cell_count": 1,
        "other_feature_transition_count": 0,
        "other_target_cell_transition_count": 0
      }
    },
    "descriptor_repair": {"$ref": "#/$defs/descriptorRepair"},
    "associated_item_kind_lowering": {"$ref": "#/$defs/itemKindLowering"},
    "existing_operation_alignment": {"$ref": "#/$defs/operationAlignment"},
    "zero_runtime_contract": {"$ref": "#/$defs/zeroRuntimeContract"},
    "diagnostic_fence": {
      "const": {
        "active_diagnostics": [
          "TRAIT_ASSOCIATED_STATIC_REQUIRES_EXPLICIT_QUALIFICATION",
          "TRAIT_ASSOCIATED_STATIC_ITEM_NOT_FOUND",
          "TRAIT_ASSOCIATED_STATIC_ITEM_KIND_MISMATCH",
          "TRAIT_ASSOCIATED_STATIC_IDENTITY_RESIDUE_INCOMPLETE",
          "TRAIT_ASSOCIATED_STATIC_RUNTIME_LOOKUP_FORBIDDEN",
          "ASSOCIATED_STATIC_VALUE_PROFILE_NOT_ADMITTED"
        ],
        "active_diagnostic_count": 6,
        "new_diagnostic_count": 0
      }
    },
    "out_of_scope_follow_up": {
      "const": {
        "catalog_spelling": "TRAIT_ASSOCIATED_STATIC_AMBIGUOUS",
        "used_as_r62_evidence": false,
        "disposition": "OUT_OF_SCOPE_CATALOG_COHERENCE_FOLLOW_UP",
        "blocks_dynamic_trace_closure": false
      }
    },
    "rules": {
      "type": "array",
      "minItems": 14,
      "maxItems": 14,
      "uniqueItems": true,
      "items": {"$ref": "#/$defs/rule"}
    },
    "acceptance_cases": {
      "type": "array",
      "minItems": 13,
      "maxItems": 13,
      "uniqueItems": true,
      "items": {"$ref": "#/$defs/acceptanceCase"}
    },
    "acceptance_bindings": {
      "const": {
        "trait_qualified_associated_static_selection": {
          "POSITIVE": ["TQASSTC-AC-001", "TQASSTC-AC-002", "TQASSTC-AC-003"],
          "BOUNDARY": ["TQASSTC-AC-004", "TQASSTC-AC-005", "TQASSTC-AC-006", "TQASSTC-AC-007"],
          "REJECT": ["TQASSTC-AC-008", "TQASSTC-AC-009", "TQASSTC-AC-010", "TQASSTC-AC-011", "TQASSTC-AC-012", "TQASSTC-AC-013"]
        }
      }
    },
    "machine_acceptance": {
      "const": {
        "feature_count": 1,
        "rule_count": 14,
        "acceptance_case_count": 13,
        "positive_case_count": 3,
        "boundary_case_count": 4,
        "reject_case_count": 6,
        "acceptance_binding_set_count": 3,
        "acceptance_bound_case_count": 13,
        "overlay_binding_count": 1,
        "predecessor_blocked_cell_count": 1,
        "overlay_bound_direct_transition_count": 1,
        "overlay_bound_delegated_transition_count": 0,
        "overlay_not_applicable_transition_count": 0,
        "identity_residue_field_count": 7,
        "implementation_callable_mapping_count": 1,
        "associated_item_kind_count": 3,
        "reused_lowering_row_count": 3,
        "new_hir_identity_count": 0,
        "new_mir_operation_kind_count": 0,
        "runtime_lookup_count": 0,
        "fallback_count": 0,
        "provider_search_count": 0,
        "order_winner_count": 0,
        "specialization_count": 0,
        "child_replacement_count": 0,
        "activation_trigger_count": 0,
        "new_commit_event_count": 0,
        "other_feature_transition_count": 0,
        "other_target_cell_transition_count": 0,
        "product_executed_count": 0
      }
    }
  },
  "$defs": {
    "descriptorRepair": {
      "type": "object",
      "additionalProperties": false,
      "required": [
        "identity_kind",
        "identity_role",
        "required_fields",
        "required_field_count",
        "item_kinds",
        "implementation_callable_mapping",
        "hir_binding",
        "mir_binding",
        "selected_identity_erased_before_mir",
        "runtime_reconstruction_count",
        "machine_address_identity_input_count"
      ],
      "properties": {
        "identity_kind": {"const": "TraitAssociatedStaticSelectionId"},
        "identity_role": {"const": "CLOSED_STATIC_SELECTION_DESCRIPTOR_ID"},
        "required_fields": {"const": ["TraitId", "RequirementId", "ConformanceId", "TraitWitnessId", "ImplementationId", "SubstitutionId", "ResponsibilityId"]},
        "required_field_count": {"const": 7},
        "item_kinds": {"const": ["associated_type", "associated_value", "associated_function"]},
        "implementation_callable_mapping": {
          "const": {
            "source_field": "ImplementationId",
            "hir_projection": "CallableImplementationId",
            "cardinality": "ONE_TO_ONE",
            "complete_before_hir_emission": true,
            "injective_within_compilation_identity_domain": true,
            "independent_candidate_selection_count": 0
          }
        },
        "hir_binding": {"const": "decl_id_or_call_head_id_REFERENCES_TraitAssociatedStaticSelectionId"},
        "mir_binding": {"const": "STATIC_REF.static_identity_id_REFERENCES_TraitAssociatedStaticSelectionId"},
        "selected_identity_erased_before_mir": {"const": false},
        "runtime_reconstruction_count": {"const": 0},
        "machine_address_identity_input_count": {"const": 0}
      }
    },
    "itemKindLowering": {
      "type": "object",
      "additionalProperties": false,
      "required": ["associated_type", "associated_value", "associated_function"],
      "properties": {
        "associated_type": {"const": {"runtime_operation_count": 0, "composition_order": ["EXACT_ASSOCIATED_TYPE_SELECTION", "NORMALIZE_SELECTED_TYPE", "NOMINAL_TYPE_SIDE_SELECTION"], "trait_or_extension_fallback_count": 0}},
        "associated_value": {"const": {"hir_form": "ResolvedRef::DirectDecl(TraitAssociatedStaticSelectionId)", "lowering_rows": ["HM-LR-REF-002", "HM-LR-TOP-002"], "operation_sequence": ["STATIC_REF", "TOTAL_PROJECTION"], "invoke_count": 0, "static_material_profile": ["IMMUTABLE", "SHAREABLE", "NO_DROP", "AUTHORITY_FREE", "ACYCLIC", "STATICALLY_MATERIALIZABLE"]}},
        "associated_function": {"const": {"hir_mode_target_pair": "ORDINARY::TRAIT_WITNESS", "hir_call_head": "TraitAssociatedStaticSelectionId", "lowering_rows": ["HM-LR-CALL-003"], "operation_sequence": ["STATIC_REF", "INVOKE"], "direct_symbol_input": ["CallableImplementationId", "SubstitutionId", "ResponsibilityId"], "semantic_target_rewrite_count": 0}}
      }
    },
    "operationAlignment": {
      "const": {
        "reused_rows": ["HM-LR-REF-002", "HM-LR-TOP-002", "HM-LR-CALL-003"],
        "reused_operations": ["STATIC_REF", "TOTAL_PROJECTION"],
        "reused_terminators": ["INVOKE"],
        "static_ref_semantic_operation_id": "DM-SEMOP-STATIC-REF-R1",
        "new_hir_node_count": 0,
        "new_mir_operation_kind_count": 0,
        "new_mir_terminator_kind_count": 0,
        "new_runtime_service_count": 0
      }
    },
    "zeroRuntimeContract": {
      "const": {
        "runtime_witness_lookup_count": 0,
        "candidate_enumeration_count": 0,
        "candidate_ranking_count": 0,
        "provider_search_count": 0,
        "fallback_count": 0,
        "source_import_use_link_order_winner_count": 0,
        "expected_result_selection_count": 0,
        "implicit_conversion_selection_count": 0,
        "specialization_count": 0,
        "child_local_witness_replacement_count": 0,
        "activation_trigger_count": 0,
        "new_commit_event_count": 0,
        "runtime_identity_reconstruction_count": 0,
        "machine_address_identity_input_count": 0
      }
    },
    "rule": {
      "type": "object",
      "additionalProperties": false,
      "required": ["rule_id", "text"],
      "properties": {
        "rule_id": {"type": "string", "pattern": "^TQASSTC-R0(0[1-9]|1[0-4])$"},
        "text": {"type": "string", "minLength": 1}
      }
    },
    "acceptanceCase": {
      "type": "object",
      "additionalProperties": false,
      "required": ["case_id", "audit_case_id", "class", "feature_id", "source_or_subject", "expected", "diagnostic_or_null", "assertions", "execution_state"],
      "properties": {
        "case_id": {"type": "string", "pattern": "^TQASSTC-AC-0(0[1-9]|1[0-3])$"},
        "audit_case_id": {"enum": ["TYPE1", "VALUE1", "FUNCTION1", "SUBSTITUTION1", "INHERITED1", "CALLABLE1", "LINK1", "EXPLICIT1", "NOTFOUND1", "KIND1", "RESIDUE1", "RUNTIME1", "VALUEPROFILE1"]},
        "class": {"enum": ["POSITIVE", "BOUNDARY", "REJECT"]},
        "feature_id": {"const": "trait_qualified_associated_static_selection"},
        "source_or_subject": {"type": "string", "minLength": 1},
        "expected": {"type": "string", "minLength": 1},
        "diagnostic_or_null": {"type": ["string", "null"]},
        "assertions": {"type": "object"},
        "execution_state": {"const": "DESIGN_STATIC_NOT_RUN"}
      }
    }
  }
}
